{
  "attempt_id": "attempt_018f6b2a-7c3a-7c20-8f3a-9c0b1d2e3f42",
  "run_id": "run_018f6b2a-7c3a-7b10-8f3a-9c0b1d2e3f41",
  "engine_id": "engine-a",
  "engine_version": "0.1.0",
  "owner": "pid-1000",
  "lease_expires_at": "2026-10-21T01:23:00Z",
  "status": "Running",
  "outcome": null,
  "error_reason": null
}
